Document_ID,Document_Text,Metadata
1,The client expressed satisfaction with the resolution of the dispute and appreciated the professionalism of the legal team.,Client Feedback
2,"The ruling imposes severe penalties on the defendant, creating significant financial and reputational harm.",Case Summary
3,"While the settlement offer is reasonable, it does not fully address the concerns raised by the plaintiff.",Settlement Review
4,"We are neutral regarding the outcome, as it aligns with standard practice and does not affect ongoing operations.",Internal Memo
5,The decision favors our position and establishes a precedent beneficial to future cases.,Legal Opinion
6,There is considerable dissatisfaction among stakeholders regarding the court's judgment.,Client Feedback
7,The legal counsel provided clear and helpful advice throughout the arbitration process.,Client Feedback
8,"The outcome appears largely positive, providing much-needed clarity on regulatory compliance requirements.",Case Analysis
9,The recent court decision has created uncertainty and concern among compliance teams.,Case Update
10,We believe the agreement represents a fair compromise acceptable to all parties.,Settlement Summary
11,The tribunal's findings were unexpected and could negatively impact future negotiations.,Arbitration Report
12,The decision neither benefits nor harms our interests materially.,Neutral Memo
13,The client expressed frustration with delays in the litigation process.,Client Communication
14,"Overall, the panel's recommendation supports our proposed course of action.",Internal Report
15,Stakeholders have voiced mixed opinions about the likely implications of the ruling.,Stakeholder Feedback
16,The resolution is favorable and supports our interpretation of contractual obligations.,Legal Summary
17,The judgment imposes a significant burden that could impact profitability.,Risk Assessment
18,Counsel provided exceptional support and demonstrated a high level of expertise.,Client Testimonial
19,The settlement does not address key concerns raised by the regulatory body.,Regulatory Review
20,We do not anticipate any major operational changes as a result of the court's decision.,Neutral Analysis
21,The outcome was disappointing and contrary to our expectations.,Case Outcome
22,The legal team successfully negotiated favorable terms for our client.,Negotiation Summary
23,This decision provides important clarity and sets a positive precedent.,Legal Update
24,Concerns have been raised regarding the fairness of the arbitration process.,Internal Memo
25,The final ruling is unlikely to materially impact our business strategy.,Strategy Assessment
26,Counsel failed to adequately communicate critical updates during proceedings.,Client Complaint
27,The ruling aligns with our interpretation and supports our compliance framework.,Compliance Report
28,"The case was resolved efficiently, and all parties expressed satisfaction.",Settlement Summary
29,The decision leaves several critical issues unresolved.,Legal Brief
30,Client feedback was overwhelmingly positive regarding the handling of the dispute.,Client Feedback
